Filesystem      Size  Used Avail Use% Mounted on
/dev/md0        3.7T  2.5T  1.3T  67% /data
=============================================================================================================
Runner Script:
mdadm --create /dev/md0 --level=mirror --raid-devices=2 /dev/sda /dev/sdb --assume-clean
mount /dev/md0 /data
systemctl start smb.service
=============================================================================================================
ls /data/root/逆水寒 -al
total 1072
drwxrwxrwx 1       6 10月 24 2019 artist
-rwxrwxrwx 1 1018752 10月 21 2019 Launcher.exe
drwxrwxrwx 1      38 10月 24 2019 NGP
drwxrwxrwx 1     158 7月  29 20:24 patch
drwxrwxrwx 1      66 5月  29 21:16 program
-rwxrwxrwx 1   71368 7月  21 2019 uninst.exe
-rwxr--r-- 1      14 7月  29 04:58 version.txt
=============================================================================================================
Model Family:     Seagate Enterprise Capacity 3.5 HDD
Device Model:     ST4000NM0035-******
Serial Number:    Z******N
LU WWN Device Id: 5 ****** 0b******d
Firmware Version: TN05
User Capacity:    4,000,787,030,016 bytes [4.00 TB]
Sector Size:      512 bytes logical/physical
Rotation Rate:    7200 rpm
Form Factor:      3.5 inches
Device is:        In smartctl database [for details use: -P show]
ATA Version is:   ACS-3 T13/2161-D revision 5
SATA Version is:  SATA 3.1, 6.0 Gb/s (current: 6.0 Gb/s)
Local Time is:    Wed Jul 29 20:28:34 2020 +08
SMART support is: Available - device has SMART capability.
SMART support is: Enabled
ID# ATTRIBUTE_NAME          FLAG     VALUE WORST THRESH TYPE      UPDATED  WHEN_FAILED RAW_VALUE
  1 Raw_Read_Error_Rate     0x000f   082   064   044    Pre-fail  Always       -       144312063
  3 Spin_Up_Time            0x0003   093   093   000    Pre-fail  Always       -       0
  4 Start_Stop_Count        0x0032   100   100   020    Old_age   Always       -       98
  5 Reallocated_Sector_Ct   0x0033   100   100   010    Pre-fail  Always       -       0
  7 Seek_Error_Rate         0x000f   091   060   045    Pre-fail  Always       -       1397565356
  9 Power_On_Hours          0x0032   095   095   000    Old_age   Always       -       4793
 10 Spin_Retry_Count        0x0013   100   100   097    Pre-fail  Always       -       0
 12 Power_Cycle_Count       0x0032   100   100   020    Old_age   Always       -       46
184 End-to-End_Error        0x0032   100   100   099    Old_age   Always       -       0
187 Reported_Uncorrect      0x0032   100   100   000    Old_age   Always       -       0
188 Command_Timeout         0x0032   100   100   000    Old_age   Always       -       0 0 0
189 High_Fly_Writes         0x003a   100   100   000    Old_age   Always       -       0
190 Airflow_Temperature_Cel 0x0022   052   043   040    Old_age   Always       -       48 (Min/Max 26/57)
191 G-Sense_Error_Rate      0x0032   097   097   000    Old_age   Always       -       6857
192 Power-Off_Retract_Count 0x0032   100   100   000    Old_age   Always       -       156
193 Load_Cycle_Count        0x0032   100   100   000    Old_age   Always       -       293
194 Temperature_Celsius     0x0022   048   057   000    Old_age   Always       -       48 (0 10 0 0 0)
195 Hardware_ECC_Recovered  0x001a   016   001   000    Old_age   Always       -       144312063
197 Current_Pending_Sector  0x0012   100   100   000    Old_age   Always       -       0
198 Offline_Uncorrectable   0x0010   100   100   000    Old_age   Offline      -       0
199 UDMA_CRC_Error_Count    0x003e   200   200   000    Old_age   Always       -       0
240 Head_Flying_Hours       0x0000   100   253   000    Old_age   Offline      -       4713h+30m+22.901s
241 Total_LBAs_Written      0x0000   100   253   000    Old_age   Offline      -       53728893326
242 Total_LBAs_Read         0x0000   100   253   000    Old_age   Offline      -       260384857606

=============================================================================================================
Model Family:     Seagate Enterprise Capacity 3.5 HDD
Device Model:     ST4000NM0035-******
Serial Number:    Z******K
LU WWN Device Id: 5 ****** 0b******3
Firmware Version: TN05
User Capacity:    4,000,787,030,016 bytes [4.00 TB]
Sector Size:      512 bytes logical/physical
Rotation Rate:    7200 rpm
Form Factor:      3.5 inches
Device is:        In smartctl database [for details use: -P show]
ATA Version is:   ACS-3 T13/2161-D revision 5
SATA Version is:  SATA 3.1, 6.0 Gb/s (current: 6.0 Gb/s)
Local Time is:    Wed Jul 29 20:29:33 2020 +08
SMART support is: Available - device has SMART capability.
SMART support is: Enabled
ID# ATTRIBUTE_NAME          FLAG     VALUE WORST THRESH TYPE      UPDATED  WHEN_FAILED RAW_VALUE
  1 Raw_Read_Error_Rate     0x000f   074   064   044    Pre-fail  Always       -       27541921
  3 Spin_Up_Time            0x0003   093   093   000    Pre-fail  Always       -       0
  4 Start_Stop_Count        0x0032   100   100   020    Old_age   Always       -       98
  5 Reallocated_Sector_Ct   0x0033   100   100   010    Pre-fail  Always       -       0
  7 Seek_Error_Rate         0x000f   091   060   045    Pre-fail  Always       -       1399419293
  9 Power_On_Hours          0x0032   095   095   000    Old_age   Always       -       4793
 10 Spin_Retry_Count        0x0013   100   100   097    Pre-fail  Always       -       0
 12 Power_Cycle_Count       0x0032   100   100   020    Old_age   Always       -       46
184 End-to-End_Error        0x0032   100   100   099    Old_age   Always       -       0
187 Reported_Uncorrect      0x0032   100   100   000    Old_age   Always       -       0
188 Command_Timeout         0x0032   100   100   000    Old_age   Always       -       0 0 0
189 High_Fly_Writes         0x003a   100   100   000    Old_age   Always       -       0
190 Airflow_Temperature_Cel 0x0022   054   046   040    Old_age   Always       -       46 (Min/Max 26/54)
191 G-Sense_Error_Rate      0x0032   095   095   000    Old_age   Always       -       10114
192 Power-Off_Retract_Count 0x0032   100   100   000    Old_age   Always       -       147
193 Load_Cycle_Count        0x0032   100   100   000    Old_age   Always       -       292
194 Temperature_Celsius     0x0022   046   054   000    Old_age   Always       -       46 (0 11 0 0 0)
195 Hardware_ECC_Recovered  0x001a   011   001   000    Old_age   Always       -       27541921
197 Current_Pending_Sector  0x0012   100   100   000    Old_age   Always       -       0
198 Offline_Uncorrectable   0x0010   100   100   000    Old_age   Offline      -       0
199 UDMA_CRC_Error_Count    0x003e   200   200   000    Old_age   Always       -       0
240 Head_Flying_Hours       0x0000   100   253   000    Old_age   Offline      -       4712h+30m+15.333s
241 Total_LBAs_Written      0x0000   100   253   000    Old_age   Offline      -       80583426070
242 Total_LBAs_Read         0x0000   100   253   000    Old_age   Offline      -       232288250631